{
  "schemaVersion": 1,
  "libraryVersion": 2,
  "region": "GLOBAL",
  "signalCatalogVersion": 1,
  "publishedAt": "2026-08-06T12:00:00.000Z",
  "minAppCapability": {
    "interactionTypes": [
      "single_choice",
      "multiple_choice",
      "ranking"
    ],
    "signalCatalogVersion": 1
  },
  "moments": [
    {
      "id": "M-P01",
      "version": 1,
      "status": "active",
      "interactionType": "single_choice",
      "emoji": "🛗",
      "title": {
        "zh": "电梯坏了",
        "en": "Broken elevator"
      },
      "audience": "universal",
      "scenario": {
        "zh": "电梯坏了，你要爬10楼。你的第一反应是？",
        "en": "The elevator’s out and you have to climb ten floors. What’s your first reaction?"
      },
      "options": [
        {
          "id": "A",
          "text": {
            "zh": "正好当锻炼",
            "en": "Free workout"
          },
          "interpretation": {
            "zh": "你可能更倾向把小麻烦转成对自己有利的事。",
            "en": "You may tend to turn small annoyances into something that works for you."
          },
          "immediate": "用户似乎倾向于把突发的不便重新解读为对自己有利的机会。",
          "weight": "Light",
          "signals": [
            {
              "signal": "CHG-01",
              "delta": 0.6,
              "confidence": "medium"
            },
            {
              "signal": "CHG-02",
              "delta": 0.3,
              "confidence": "low"
            },
            {
              "signal": "CHG-03",
              "delta": 0.25,
              "confidence": "low"
            }
          ],
          "sliders": {
            "c": 12,
            "t": 6
          }
        },
        {
          "id": "B",
          "text": {
            "zh": "这物业真不行",
            "en": "This building is so badly run"
          },
          "interpretation": {
            "zh": "你似乎对规则和责任比较敏感，出了问题，该有人负责。",
            "en": "You seem tuned in to rules and responsibility — when something breaks, someone should answer for it."
          },
          "immediate": "用户似乎倾向于先定位责任方，把问题归入「有人失责」。",
          "weight": "Light",
          "signals": [
            {
              "signal": "CAR-05",
              "delta": 0.6,
              "confidence": "medium"
            },
            {
              "signal": "TRU-04",
              "delta": 0.4,
              "confidence": "low"
            },
            {
              "signal": "TRU-03",
              "delta": -0.2,
              "confidence": "low"
            }
          ],
          "sliders": {
            "h": -8,
            "c": 4
          }
        },
        {
          "id": "C",
          "text": {
            "zh": "今天运气差",
            "en": "Just my luck today"
          },
          "interpretation": {
            "zh": "你可能倾向用运气解释外部事件。",
            "en": "You may lean on luck to explain what the world throws at you."
          },
          "immediate": "用户似乎暂时倾向于用运气解释外部的不顺。",
          "weight": "Light",
          "signals": [
            {
              "signal": "MEA-11",
              "delta": 0.6,
              "confidence": "medium"
            },
            {
              "signal": "EMW-01",
              "delta": 0.3,
              "confidence": "low"
            },
            {
              "signal": "CHG-03",
              "delta": -0.3,
              "confidence": "low"
            }
          ],
          "sliders": {
            "c": -12
          }
        },
        {
          "id": "D",
          "text": {
            "zh": "无所谓，爬就是了",
            "en": "Whatever — just take the stairs"
          },
          "interpretation": {
            "zh": "你似乎更倾向接受现实，不在小事上消耗情绪。",
            "en": "You seem to accept what’s in front of you without spending emotion on the small stuff."
          },
          "immediate": "用户似乎倾向于直接接受眼前情况，并继续行动。",
          "weight": "Light",
          "signals": [
            {
              "signal": "EMW-01",
              "delta": 0.6,
              "confidence": "medium"
            },
            {
              "signal": "CHG-02",
              "delta": 0.35,
              "confidence": "low"
            },
            {
              "signal": "EMW-02",
              "delta": 0.3,
              "confidence": "low"
            },
            {
              "signal": "CHG-03",
              "delta": 0.1,
              "confidence": "low"
            }
          ],
          "sliders": {
            "a": -8,
            "c": -3
          }
        }
      ]
    },
    {
      "id": "M-P02",
      "version": 1,
      "status": "active",
      "interactionType": "single_choice",
      "emoji": "👀",
      "title": {
        "zh": "没人扶",
        "en": "Nobody helps"
      },
      "audience": "universal",
      "scenario": {
        "zh": "路边有人摔倒，周围没人扶。你觉得多数人不扶是因为？",
        "en": "Someone slips and falls on the street, and nobody stops to help. Why do you think most people walk past?"
      },
      "options": [
        {
          "id": "A",
          "text": {
            "zh": "怕被讹",
            "en": "They’re afraid of being blamed — or sued"
          },
          "interpretation": {
            "zh": "你可能认为环境会影响善意的成本，对现实保持清醒。",
            "en": "You may see how much a good deed can cost, and stay clear-eyed about it."
          },
          "immediate": "用户似乎倾向于用现实风险解释人们的克制。",
          "weight": "Light",
          "signals": [
            {
              "signal": "TRU-02",
              "delta": 0.5,
              "confidence": "medium"
            },
            {
              "signal": "TRU-03",
              "delta": -0.4,
              "confidence": "low"
            },
            {
              "signal": "TRU-01",
              "delta": -0.25,
              "confidence": "low"
            }
          ],
          "sliders": {
            "h": -10
          }
        },
        {
          "id": "B",
          "text": {
            "zh": "冷漠自私",
            "en": "People just don’t care"
          },
          "interpretation": {
            "zh": "你似乎对人性的期待偏谨慎，先设防，再靠近。",
            "en": "Your expectations of people seem cautious — guard up first, warm up later."
          },
          "immediate": "用户似乎暂时倾向于用人性品质解释他人的不作为。",
          "weight": "Light",
          "signals": [
            {
              "signal": "TRU-01",
              "delta": -0.6,
              "confidence": "medium"
            },
            {
              "signal": "TRU-02",
              "delta": 0.35,
              "confidence": "low"
            },
            {
              "signal": "TRU-05",
              "delta": -0.3,
              "confidence": "low"
            }
          ],
          "sliders": {
            "h": -12
          }
        },
        {
          "id": "C",
          "text": {
            "zh": "没注意到",
            "en": "They probably didn’t notice"
          },
          "interpretation": {
            "zh": "你更倾向给出中性的解释，不轻易下判断。",
            "en": "You lean toward neutral explanations and don’t rush to judge."
          },
          "immediate": "用户似乎倾向于先给出不涉动机的情境解释。",
          "weight": "Very Light",
          "signals": [
            {
              "signal": "TRU-05",
              "delta": 0.5,
              "confidence": "medium"
            },
            {
              "signal": "TRU-01",
              "delta": 0.25,
              "confidence": "low"
            }
          ],
          "sliders": {
            "h": 8
          }
        },
        {
          "id": "D",
          "text": {
            "zh": "每个人都有自己的难处",
            "en": "Everyone’s carrying something of their own"
          },
          "interpretation": {
            "zh": "你似乎习惯站在别人的处境里理解行为。",
            "en": "You seem used to understanding behavior from inside other people’s situations."
          },
          "immediate": "用户似乎倾向于站在他人的处境中理解行为。",
          "weight": "Light",
          "signals": [
            {
              "signal": "TRU-01",
              "delta": 0.5,
              "confidence": "medium"
            },
            {
              "signal": "TRU-05",
              "delta": 0.4,
              "confidence": "low"
            },
            {
              "signal": "MEA-12",
              "delta": 0.3,
              "confidence": "low"
            }
          ],
          "sliders": {
            "h": 12
          }
        }
      ]
    },
    {
      "id": "M-P03",
      "version": 1,
      "status": "active",
      "interactionType": "single_choice",
      "emoji": "🐈",
      "title": {
        "zh": "流浪猫",
        "en": "The stray cat"
      },
      "audience": "universal",
      "scenario": {
        "zh": "一只流浪猫总来你家门口，你会怎么做？",
        "en": "A stray cat keeps showing up at your door. What would you do?"
      },
      "options": [
        {
          "id": "A",
          "text": {
            "zh": "偶尔喂它，但不收养",
            "en": "Feed it sometimes, but not take it in"
          },
          "interpretation": {
            "zh": "你可能温和而有边界：愿意付出，但保留空间。",
            "en": "Warm but boundaried: willing to give, while keeping some space."
          },
          "immediate": "用户似乎倾向于付出善意的同时保留边界。",
          "weight": "Light",
          "signals": [
            {
              "signal": "CAR-01",
              "delta": 0.5,
              "confidence": "medium"
            },
            {
              "signal": "REL-04",
              "delta": 0.4,
              "confidence": "low"
            },
            {
              "signal": "REL-05",
              "delta": 0.3,
              "confidence": "low"
            }
          ],
          "sliders": {
            "n": 5,
            "h": 3
          }
        },
        {
          "id": "B",
          "text": {
            "zh": "把它带回家收养",
            "en": "Take it home and adopt it"
          },
          "interpretation": {
            "zh": "你似乎愿意为一段联结承担长期的责任。",
            "en": "You seem willing to take on long-term responsibility for a bond."
          },
          "immediate": "用户似乎倾向于较快承接一段长期责任。",